{
  "version": "kc.scene.v1",
  "seed": "kc:Tyr1onX:github:2026-08-19:v1",
  "subject": {
    "id": "Tyr1onX",
    "label": "栖白 · Tyr1onX",
    "language": "zh-CN",
    "scope": "GitHub evidence · 2026-08-19"
  },
  "viewport": {
    "width": 1200,
    "height": 860
  },
  "identity": {
    "family": "monogram",
    "label": "Tyr1onX",
    "title": "栖白 · Tyr1onX",
    "subtitle": "产品工程 · 开源协作 · Web 学习 · Agent 工具 · 程序化表达",
    "source": "GitHub @Tyr1onX",
    "monogram": "TY",
    "x": 600,
    "y": 430,
    "presence": {
      "mode": "brief_intro",
      "subtitle": "由真实项目、学习记录与开源贡献生长出的知识星图"
    }
  },
  "composition": {
    "archetype": "sparse_archipelago",
    "asymmetry": 0.64,
    "openness": 0.74,
    "dominant_axis": "diagonal"
  },
  "field": {
    "density": "sparse",
    "dust_family": "cold_filament",
    "temperature_bias": "cool_neutral"
  },
  "stars": {
    "family": "subtle_point",
    "temperature_variation": "medium"
  },
  "motion": {
    "temperament": "balanced"
  },
  "nodes": [
    {
      "id": "oss-core",
      "name": "开源协作",
      "en": "Open-source Collaboration",
      "g": "oss",
      "layer": "primary",
      "kind": "core",
      "size": 0.97,
      "x": 215,
      "y": 235,
      "summary": "持续进入真实开源项目的 Issue / PR / Review / CI 流程；这里表达的是可追溯参与与工程行为，不把合并次数直接等同于独立能力。",
      "project": "开源协作",
      "anchor_id": "a-oss",
      "evidence": [
        {
          "id": "e-oss-core",
          "observation": "个人主页明确将开源协作列为持续活动，并列出多项外部已合并 PR。",
          "source_ids": [
            "profile"
          ]
        }
      ],
      "sources": [
        {
          "id": "profile",
          "title": "Tyr1onX GitHub Profile README"
        }
      ]
    },
    {
      "id": "pr-flow",
      "name": "PR / Review 流程",
      "en": "Pull Request Workflow",
      "g": "oss",
      "layer": "primary",
      "kind": "normal",
      "size": 0.89,
      "x": 330,
      "y": 300,
      "summary": "PR 描述、范围控制、测试证据、维护者反馈与后续修正反复出现在实际协作中。",
      "project": "开源协作",
      "anchor_id": "a-oss",
      "evidence": [
        {
          "id": "e-pr-flow",
          "observation": "多项外部 PR 保留了问题、根因、范围、测试与后续修正记录。",
          "source_ids": [
            "oss1271",
            "oss1284",
            "avenx1050"
          ]
        }
      ],
      "sources": [
        {
          "id": "oss1271",
          "title": "Fmarzochi/EGC PR #1271 · exactly-once session delivery"
        },
        {
          "id": "oss1284",
          "title": "Fmarzochi/EGC PR #1284 · chaos harness cleanup"
        },
        {
          "id": "avenx1050",
          "title": "Avenx-JS/avenx-js PR #1050 · custom HTTP headers"
        }
      ]
    },
    {
      "id": "repro-debug",
      "name": "复现与故障定位",
      "en": "Reproduction & Debugging",
      "g": "oss",
      "layer": "primary",
      "kind": "normal",
      "size": 0.91,
      "x": 160,
      "y": 350,
      "summary": "从失败现象建立可重复条件，再收敛到更小的根因；这一模式在并发、QQ 导出与诊断保留问题中多次出现。",
      "project": "开源协作",
      "anchor_id": "a-oss",
      "evidence": [
        {
          "id": "e-repro",
          "observation": "EGC #1271 保留并发重复投递的 deterministic reproducer；QCE #635/#636 也记录了对旧 fallback 失效原因的重新诊断。",
          "source_ids": [
            "oss1271",
            "qce635",
            "qce636"
          ]
        }
      ],
      "sources": [
        {
          "id": "oss1271",
          "title": "Fmarzochi/EGC PR #1271 · exactly-once session delivery"
        },
        {
          "id": "qce635",
          "title": "shuakami/qq-chat-exporter PR #635 · local DB streaming"
        },
        {
          "id": "qce636",
          "title": "shuakami/qq-chat-exporter PR #636 · device export fallback"
        }
      ]
    },
    {
      "id": "regression-ci",
      "name": "回归测试与 CI",
      "en": "Regression Testing & CI",
      "g": "oss",
      "layer": "primary",
      "kind": "normal",
      "size": 0.87,
      "x": 315,
      "y": 175,
      "summary": "新增或加强回归测试，并用多环境 CI 验证修复边界，是多项贡献的稳定组成部分。",
      "project": "开源协作",
      "anchor_id": "a-oss",
      "evidence": [
        {
          "id": "e-reg-ci",
          "observation": "EGC #1271/#1284、Avenx #1050 均将回归覆盖与 CI 作为验收证据。",
          "source_ids": [
            "oss1271",
            "oss1284",
            "avenx1050"
          ]
        }
      ],
      "sources": [
        {
          "id": "oss1271",
          "title": "Fmarzochi/EGC PR #1271 · exactly-once session delivery"
        },
        {
          "id": "oss1284",
          "title": "Fmarzochi/EGC PR #1284 · chaos harness cleanup"
        },
        {
          "id": "avenx1050",
          "title": "Avenx-JS/avenx-js PR #1050 · custom HTTP headers"
        }
      ]
    },
    {
      "id": "concurrency-cas",
      "name": "并发 / CAS",
      "en": "Concurrency / CAS",
      "g": "oss",
      "layer": "secondary",
      "kind": "soft",
      "size": 0.64,
      "x": 80,
      "y": 250,
      "summary": "并发读取、游标比较交换和 SQLite WAL 进入过真实修复场景；这颗星表示有直接实践证据，不延伸为广义并发“精通”。",
      "project": "EGC #1271",
      "anchor_id": "a-oss",
      "evidence": [
        {
          "id": "e-cas",
          "observation": "EGC #1271 记录两个 reader 竞争同一 session cursor，并以 compare-and-swap 解决重复投递。",
          "source_ids": [
            "oss1271"
          ]
        }
      ],
      "sources": [
        {
          "id": "oss1271",
          "title": "Fmarzochi/EGC PR #1271 · exactly-once session delivery"
        }
      ]
    },
    {
      "id": "cross-project",
      "name": "跨项目修复",
      "en": "Cross-project Fixes",
      "g": "oss",
      "layer": "secondary",
      "kind": "trace",
      "size": 0.6,
      "x": 370,
      "y": 390,
      "summary": "贡献范围不只集中于单一仓库，涉及 CLI HTTP headers、日志诊断与聊天记录导出等不同问题域。",
      "project": "开源协作",
      "anchor_id": "a-oss",
      "evidence": [
        {
          "id": "e-cross",
          "observation": "外部 PR 覆盖 Avenx CLI、EGC diagnostics 与 QQ Chat Exporter 数据读取路径。",
          "source_ids": [
            "avenx1050",
            "oss1303",
            "qce636"
          ]
        }
      ],
      "sources": [
        {
          "id": "avenx1050",
          "title": "Avenx-JS/avenx-js PR #1050 · custom HTTP headers"
        },
        {
          "id": "oss1303",
          "title": "Fmarzochi/EGC PR #1303 · diagnostic inflections"
        },
        {
          "id": "qce636",
          "title": "shuakami/qq-chat-exporter PR #636 · device export fallback"
        }
      ]
    },
    {
      "id": "7byte-core",
      "name": "7BYTE 内容生产系统",
      "en": "7BYTE Production System",
      "g": "creative",
      "layer": "primary",
      "kind": "core",
      "size": 0.94,
      "x": 585,
      "y": 105,
      "summary": "把选题、脚本、分镜、动画规格、发布记录与复用规则组织成可持续迭代的内容生产系统。",
      "project": "7BYTE",
      "anchor_id": "a-7byte",
      "evidence": [
        {
          "id": "e-7byte-core",
          "observation": "7BYTE README 将仓库定义为长期 AI 工作上下文、每期独立创作单元和可复用 Motion Design System。",
          "source_ids": [
            "byte"
          ]
        }
      ],
      "sources": [
        {
          "id": "byte",
          "title": "7BYTE Content · README"
        }
      ]
    },
    {
      "id": "motion-canvas",
      "name": "Motion Canvas 程序化动画",
      "en": "Motion Canvas",
      "g": "creative",
      "layer": "primary",
      "kind": "normal",
      "size": 0.84,
      "x": 710,
      "y": 165,
      "summary": "关系型、链路型和对比型内容优先使用程序化动画，并以对象连续性帮助观众理解。",
      "project": "7BYTE",
      "anchor_id": "a-7byte",
      "evidence": [
        {
          "id": "e-motion",
          "observation": "7BYTE 固定原则明确动画优先 Motion Canvas，并优先程序化复现 UI。",
          "source_ids": [
            "byte"
          ]
        }
      ],
      "sources": [
        {
          "id": "byte",
          "title": "7BYTE Content · README"
        }
      ]
    },
    {
      "id": "shot-qa",
      "name": "镜头设计与视觉 QA",
      "en": "Shot Design & Visual QA",
      "g": "creative",
      "layer": "primary",
      "kind": "normal",
      "size": 0.86,
      "x": 480,
      "y": 185,
      "summary": "镜头动作以解释为目的，跨镜语义对象遵守 owner / lifecycle / matched-geometry，并在最终输出前做关键帧视觉审计。",
      "project": "7BYTE",
      "anchor_id": "a-7byte",
      "evidence": [
        {
          "id": "e-shot",
          "observation": "7BYTE README 明确跨镜对象所有权、连续性和关键帧视觉审计要求。",
          "source_ids": [
            "byte"
          ]
        }
      ],
      "sources": [
        {
          "id": "byte",
          "title": "7BYTE Content · README"
        }
      ]
    },
    {
      "id": "workflow-memory",
      "name": "生产经验沉淀",
      "en": "Production Memory",
      "g": "creative",
      "layer": "secondary",
      "kind": "soft",
      "size": 0.61,
      "x": 650,
      "y": 245,
      "summary": "将上一期经验、品牌规则、字幕、镜头和封面方法沉淀为后续 Agent 可读取的生产上下文。",
      "project": "7BYTE",
      "anchor_id": "a-7byte",
      "evidence": [
        {
          "id": "e-prod-memory",
          "observation": "7BYTE 要求 Agent 从 AGENTS.md、production workflow、skills 和上一期设计记录恢复上下文。",
          "source_ids": [
            "byte"
          ]
        }
      ],
      "sources": [
        {
          "id": "byte",
          "title": "7BYTE Content · README"
        }
      ]
    },
    {
      "id": "personal-web",
      "name": "个人 Web 交互",
      "en": "Personal Web Interaction",
      "g": "creative",
      "layer": "primary",
      "kind": "soft",
      "size": 0.78,
      "x": 515,
      "y": 265,
      "summary": "个人站以项目、记录与当前想法为入口，持续关注响应式、主题和轻量交互动效。",
      "project": "Tyr1onX.github.io",
      "anchor_id": "a-site",
      "evidence": [
        {
          "id": "e-site",
          "observation": "个人站 README 明确响应式布局、深浅色主题与轻量滚动动效。",
          "source_ids": [
            "site"
          ]
        }
      ],
      "sources": [
        {
          "id": "site",
          "title": "Tyr1onX.github.io · README"
        }
      ]
    },
    {
      "id": "transition-stability",
      "name": "跨页面转场稳定性",
      "en": "Navigation Transition Stability",